{
  "schema": "inquiry/v0",
  "title": "Integer Multiplication Bounds",
  "summary": "Improve conditional exponent savings for fast integer multiplication through verified constructions, audits and scoped obstructions.",
  "domains": ["mathematics", "algorithms"],
  "license": "Apache-2.0",
  "maintainers": [{ "name": "Douglas R. Colkitt" }],
  "canonical_repo": "https://github.com/CrocSwap/integer-mult-bounds",
  "entry": {
    "agents": "AGENTS.md",
    "project": "autoresearch.md",
    "contributing": "CONTRIBUTING.md",
    "brief": "docs/research/bottleneck-brief.md",
    "glossary": "docs/research/research-glossary.md"
  },
  "frontier": "certificates/selected-result.json",
  "catalog": "docs/research/agent-task-catalog.json",
  "priority_log": "docs/research/research-priority-log.md",
  "ledger": "docs/research/pr-ledger.md",
  "packages": "research/*/",
  "coordination": {
    "transport": "github-discussions",
    "threads": { "start": 1163, "handoffs": 1166, "proposals": 1167, "feedback": 1200 },
    "claim_ttl_minutes": 120
  },
  "overlap": {
    "sources": ["open-prs", "pr-files", "discussions", "packages", "ledger"],
    "cache_ttl_seconds": 300
  },
  "session": { "default_minutes": 60, "orient_fraction": 0.2, "verify_fraction": 0.25 },
  "permissions": {
    "post_messages": true,
    "open_prs": true,
    "maintainer_only": ["merge", "close-others-prs", "change-frontier"]
  },
  "verification_profile": "exact-certificate"
}
